{"eventId":"b1000000-0000-4000-8000-000000000001","eventType":"contact.attempt.recorded","schemaVersion":1,"tenantId":"tenant-field","correlationId":"corr-m31-contact","causationId":"contact-m31-001","aggregateType":"ContactAttempt","aggregateId":"b2000000-0000-4000-8000-000000000001","aggregateVersion":1,"occurredAt":"2026-07-14T11:01:00Z","payload":{"contactAttemptId":"b2000000-0000-4000-8000-000000000001","projectId":"b3000000-0000-4000-8000-000000000001","workOrderId":"b4000000-0000-4000-8000-000000000001","taskId":"b5000000-0000-4000-8000-000000000001","channel":"PHONE","contactedPartyRef":"customer-ref","startedAt":"2026-07-14T11:00:00Z","endedAt":"2026-07-14T11:01:00Z","resultCode":"CONNECTED","nextContactAt":null,"actorId":"scheduler","occurredAt":"2026-07-14T11:01:00Z","eventType":"contact.attempt.recorded"}}
